{
  "schemaVersion": "OwlCodaRunKitFinalizeRequestV1",
  "receiptId": "replace-with-stable-receipt-id",
  "deliveryPacketPath": ".owlcoda/runkit/executions/replace-with-run-id/delivery-packets/replace-with-packet.json",
  "verificationContext": {
    "schemaVersion": "OwlCodaRunKitVerificationContextV1",
    "reusePolicy": "portable",
    "platform": null,
    "toolchains": [],
    "lockfiles": [],
    "fixtures": [],
    "services": [],
    "environment": []
  },
  "snapshotPaths": [
    ".owlcoda/runkit/executions/replace-with-run-id/snapshots/replace-with-snapshot.json"
  ]
}
